{"history":[{"attachmentId":3,"placeId":5,"placePath":["Southgate Mall","West wing"],"fromAt":"2026-12-20T20:00:00.000Z","toAt":null,"people":42,"earlyScans":2}],"daily":[{"day":"2026-12-20","people":12},{"day":"2026-12-21","people":18},{"day":"2026-12-22","people":12}],"id":1,"tag":"qr-001","batchNo":1,"printedAt":"2026-12-20T18:00:00.000Z","active":true,"note":"","opensPageId":null,"forwardUrl":null,"opens":{"kind":"page","pageId":4,"slug":"sponsors","url":null},"opensSource":"place","attachment":{"id":3,"placeId":5,"placePath":["Southgate Mall","West wing"],"since":"2026-12-20T20:00:00.000Z"},"scans":{"people":42,"flagged":3,"lastScanAt":"2026-12-22T01:00:00.000Z"},"createdBy":"canvasser@wmsfo.test","createdAt":"2026-12-20T18:00:00.000Z","updatedAt":"2026-12-20T20:00:00.000Z","audit":{"action":"attach","by":"person:canvasser@wmsfo.test","at":"2026-12-20T20:00:00.000Z"}}